{
  "$defs": {
    "file": {
      "additionalProperties": false,
      "properties": {
        "byte_length": {
          "minimum": 1,
          "type": "integer"
        },
        "hash_algorithm": {
          "const": "sha256_bytes_v1"
        },
        "path": {
          "pattern": "^[A-Za-z0-9_-][A-Za-z0-9._-]*(?:/[A-Za-z0-9_-][A-Za-z0-9._-]*)*$",
          "type": "string"
        },
        "sha256": {
          "pattern": "^[0-9a-f]{64}$",
          "type": "string"
        }
      },
      "required": [
        "path",
        "byte_length",
        "sha256",
        "hash_algorithm"
      ],
      "type": "object"
    },
    "source_file": {
      "additionalProperties": false,
      "properties": {
        "byte_length": {
          "minimum": 1,
          "type": "integer"
        },
        "hash_algorithm": {
          "const": "sha256_bytes_v1"
        },
        "path": {
          "pattern": "^[A-Za-z0-9_-][A-Za-z0-9._-]*(?:/[A-Za-z0-9_-][A-Za-z0-9._-]*)*$",
          "type": "string"
        },
        "role": {
          "minLength": 1,
          "type": "string"
        },
        "sha256": {
          "pattern": "^[0-9a-f]{64}$",
          "type": "string"
        }
      },
      "required": [
        "role",
        "path",
        "byte_length",
        "sha256",
        "hash_algorithm"
      ],
      "type": "object"
    }
  },
  "$id": "https://radroots.org/core/event-store/food-availability-projection-manifest-v1.schema.json",
  "$schema": "https://json-schema.org/draft/2020-12/schema",
  "additionalProperties": false,
  "properties": {
    "contract_id": {
      "const": "radroots_event_store.food_availability_projection_v1"
    },
    "entry_points": {
      "items": {
        "additionalProperties": false,
        "properties": {
          "role": {
            "minLength": 1,
            "type": "string"
          },
          "rust_path": {
            "minLength": 1,
            "type": "string"
          }
        },
        "required": [
          "role",
          "rust_path"
        ],
        "type": "object"
      },
      "minItems": 1,
      "type": "array"
    },
    "food_profile_vector": {
      "$ref": "#/$defs/file"
    },
    "hook_id": {
      "const": "food_availability_projection_v1"
    },
    "manifest_schema": {
      "$ref": "#/$defs/file"
    },
    "migration": {
      "additionalProperties": false,
      "properties": {
        "catalog": {
          "additionalProperties": false,
          "properties": {
            "fts5_tables": {
              "items": {
                "minLength": 1,
                "type": "string"
              },
              "type": "array",
              "uniqueItems": true
            },
            "objects": {
              "items": {
                "minLength": 1,
                "type": "string"
              },
              "type": "array",
              "uniqueItems": true
            },
            "tables": {
              "items": {
                "minLength": 1,
                "type": "string"
              },
              "type": "array",
              "uniqueItems": true
            }
          },
          "required": [
            "objects",
            "tables",
            "fts5_tables"
          ],
          "type": "object"
        },
        "down": {
          "$ref": "#/$defs/file"
        },
        "name": {
          "const": "food_availability_projection"
        },
        "schema_sha256": {
          "const": "dd12467e04addcbddb5ea0f386c12a8ac05ef5ebaaf949f24dd2c62745f5aaac"
        },
        "up": {
          "$ref": "#/$defs/file"
        },
        "version": {
          "const": 3
        }
      },
      "required": [
        "version",
        "name",
        "up",
        "down",
        "schema_sha256",
        "catalog"
      ],
      "type": "object"
    },
    "predecessor": {
      "additionalProperties": false,
      "properties": {
        "hook_id": {
          "const": "nip09_reconciliation_v1"
        },
        "manifest": {
          "$ref": "#/$defs/file"
        }
      },
      "required": [
        "hook_id",
        "manifest"
      ],
      "type": "object"
    },
    "profile": {
      "additionalProperties": false,
      "properties": {
        "addressable_feed_version": {
          "const": 1
        },
        "admission_authority": {
          "const": "event_contract_registry_v7"
        },
        "current_visibility_authority": {
          "const": "radroots_event_store_current_visibility_v1"
        },
        "event_contract_registry_version": {
          "const": 7
        },
        "food_contract_id": {
          "const": "radroots.food.availability.v1"
        },
        "post_core_capability": {
          "const": "apply_v2"
        },
        "projection_version": {
          "const": 1
        },
        "scope_fingerprint_sha256": {
          "const": "8b63c5ddc48a2cc7db69295238b96d5f814dba50427c80b4d0079f061e6d3de0"
        },
        "scope_kinds": {
          "maxItems": 1,
          "minItems": 1,
          "prefixItems": [
            {
              "const": 30402
            }
          ],
          "type": "array"
        }
      },
      "required": [
        "event_contract_registry_version",
        "addressable_feed_version",
        "projection_version",
        "scope_kinds",
        "scope_fingerprint_sha256",
        "food_contract_id",
        "admission_authority",
        "current_visibility_authority",
        "post_core_capability"
      ],
      "type": "object"
    },
    "public_api": {
      "items": {
        "minLength": 1,
        "type": "string"
      },
      "type": "array",
      "uniqueItems": true
    },
    "registry_inventory": {
      "$ref": "#/$defs/file"
    },
    "result_vector": {
      "additionalProperties": false,
      "properties": {
        "byte_length": {
          "minimum": 1,
          "type": "integer"
        },
        "canonical_path": {
          "const": "contracts/conformance/vectors/event_store/food_availability_projection.v1.json"
        },
        "executor_byte_length": {
          "minimum": 1,
          "type": "integer"
        },
        "executor_hash_algorithm": {
          "const": "sha256_bytes_v1"
        },
        "executor_id": {
          "const": "radroots_event_store.food_availability_projection_v1.result_vector_executor.v1"
        },
        "executor_path": {
          "const": "crates/event_store/tests/food_availability_projection_v1_result_vector.rs"
        },
        "executor_sha256": {
          "pattern": "^[0-9a-f]{64}$",
          "type": "string"
        },
        "executor_test": {
          "const": "food_availability_projection_v1_result_vector"
        },
        "hash_algorithm": {
          "const": "sha256_bytes_v1"
        },
        "mirror_path": {
          "const": "crates/event_store/tests/fixtures/food_availability_projection.v1.json"
        },
        "sha256": {
          "pattern": "^[0-9a-f]{64}$",
          "type": "string"
        }
      },
      "required": [
        "canonical_path",
        "mirror_path",
        "byte_length",
        "sha256",
        "hash_algorithm",
        "executor_id",
        "executor_path",
        "executor_test",
        "executor_byte_length",
        "executor_sha256",
        "executor_hash_algorithm"
      ],
      "type": "object"
    },
    "schema_version": {
      "const": 1
    },
    "source_files": {
      "items": {
        "$ref": "#/$defs/source_file"
      },
      "minItems": 1,
      "type": "array"
    }
  },
  "required": [
    "schema_version",
    "contract_id",
    "hook_id",
    "manifest_schema",
    "predecessor",
    "migration",
    "profile",
    "registry_inventory",
    "food_profile_vector",
    "entry_points",
    "source_files",
    "public_api",
    "result_vector"
  ],
  "title": "Radroots event-store FoodAvailability projection manifest v1",
  "type": "object"
}
