{
  "schema_version": 1,
  "contract_id": "radroots_event_store.food_availability_projection_v1",
  "hook_id": "food_availability_projection_v1",
  "manifest_schema": {
    "path": "crates/event_store/contracts/food_availability_projection_v1.manifest.schema.json",
    "byte_length": 7964,
    "sha256": "39171f6ef872a8d1483bc3d55049df5e0d110d9131c5adb4450b7c418f546910",
    "hash_algorithm": "sha256_bytes_v1"
  },
  "predecessor": {
    "hook_id": "nip09_reconciliation_v1",
    "manifest": {
      "path": "crates/event_store/contracts/nip09_reconciliation_v1.manifest.json",
      "byte_length": 537538,
      "sha256": "74af832420ffbaa9805e89df3c0b34f126a443e1598f757e3372f407f9003b77",
      "hash_algorithm": "sha256_bytes_v1"
    }
  },
  "migration": {
    "version": 3,
    "name": "food_availability_projection",
    "up": {
      "path": "crates/event_store/migrations/0003_food_availability_projection.up.sql",
      "byte_length": 23683,
      "sha256": "4e7edfb981b25f76055efc7802ec30b4034eeae9b9c0809ea4ea7c574678748a",
      "hash_algorithm": "sha256_bytes_v1"
    },
    "down": {
      "path": "crates/event_store/migrations/0003_food_availability_projection.down.sql",
      "byte_length": 1755,
      "sha256": "29d663320109d9dd0df6a00b6a53d8d988438d01f7a66960a9d4ba3482ffffb8",
      "hash_algorithm": "sha256_bytes_v1"
    },
    "schema_sha256": "dd12467e04addcbddb5ea0f386c12a8ac05ef5ebaaf949f24dd2c62745f5aaac",
    "catalog": {
      "objects": [
        "radroots_event_store_addressable_feed_generation_insert",
        "radroots_event_store_addressable_feed_integrity_v1",
        "radroots_event_store_addressable_feed_transition_insert",
        "radroots_event_store_addressable_transition_coordinate_idx",
        "radroots_event_store_current_visibility_head_lookup_idx",
        "radroots_event_store_current_visibility_v1",
        "radroots_event_store_food_availability_author_idx",
        "radroots_event_store_food_availability_cursor",
        "radroots_event_store_food_availability_cursor_delete_guard",
        "radroots_event_store_food_availability_cursor_insert_guard",
        "radroots_event_store_food_availability_cursor_update_guard",
        "radroots_event_store_food_availability_image",
        "radroots_event_store_food_availability_image_delete_guard",
        "radroots_event_store_food_availability_image_insert_guard",
        "radroots_event_store_food_availability_image_update_guard",
        "radroots_event_store_food_availability_projection",
        "radroots_event_store_food_availability_projection_delete_guard",
        "radroots_event_store_food_availability_projection_insert_guard",
        "radroots_event_store_food_availability_projection_update_guard",
        "radroots_event_store_food_availability_read_v1",
        "radroots_event_store_food_availability_recent_idx",
        "radroots_event_store_food_availability_search_delete",
        "radroots_event_store_food_availability_search_fts",
        "radroots_event_store_food_availability_search_fts_config",
        "radroots_event_store_food_availability_search_fts_content",
        "radroots_event_store_food_availability_search_fts_data",
        "radroots_event_store_food_availability_search_fts_docsize",
        "radroots_event_store_food_availability_search_fts_idx",
        "radroots_event_store_food_availability_search_insert",
        "radroots_event_store_food_availability_status_idx",
        "radroots_event_store_nip09_address_target_visibility_lookup_idx"
      ],
      "tables": [
        "radroots_event_store_addressable_feed_integrity_v1",
        "radroots_event_store_food_availability_cursor",
        "radroots_event_store_food_availability_image",
        "radroots_event_store_food_availability_projection",
        "radroots_event_store_food_availability_search_fts",
        "radroots_event_store_food_availability_search_fts_config",
        "radroots_event_store_food_availability_search_fts_content",
        "radroots_event_store_food_availability_search_fts_data",
        "radroots_event_store_food_availability_search_fts_docsize",
        "radroots_event_store_food_availability_search_fts_idx"
      ],
      "fts5_tables": [
        "radroots_event_store_food_availability_search_fts"
      ]
    }
  },
  "profile": {
    "event_contract_registry_version": 7,
    "addressable_feed_version": 1,
    "projection_version": 1,
    "scope_kinds": [
      30402
    ],
    "scope_fingerprint_sha256": "8b63c5ddc48a2cc7db69295238b96d5f814dba50427c80b4d0079f061e6d3de0",
    "food_contract_id": "radroots.food.availability.v1",
    "admission_authority": "event_contract_registry_v7",
    "current_visibility_authority": "radroots_event_store_current_visibility_v1",
    "post_core_capability": "apply_v2"
  },
  "registry_inventory": {
    "path": "contracts/event_store/event_contract_registry_v7.inventory.json",
    "byte_length": 158021,
    "sha256": "91595544310f865bdef064ee760c227c870417a95b87b3e27278f8da74fdddea",
    "hash_algorithm": "sha256_bytes_v1"
  },
  "food_profile_vector": {
    "path": "contracts/conformance/vectors/food_availability/profile.v1.json",
    "byte_length": 90099,
    "sha256": "dede1eb1f682ecd548e8cd3ccb251d298762e504e2588a73528e5f7a5b9eff21",
    "hash_algorithm": "sha256_bytes_v1"
  },
  "entry_points": [
    {
      "role": "registry_v7_admission",
      "rust_path": "radroots_event_codec::admit_verified_event_registry_v7"
    },
    {
      "role": "migration_registry",
      "rust_path": "radroots_event_store::migrations::EVENT_STORE_MIGRATIONS[2]"
    },
    {
      "role": "migration_apply_hook",
      "rust_path": "radroots_event_store::schema::apply_migration_hook"
    },
    {
      "role": "migration_validation_hook",
      "rust_path": "radroots_event_store::schema::validate_migration_hook_state"
    },
    {
      "role": "post_core_extension",
      "rust_path": "radroots_event_store::store::PostCoreExtensionCapabilities::apply_v2"
    },
    {
      "role": "addressable_transition_feed",
      "rust_path": "radroots_event_store::RadrootsEventStore::addressable_transition_page_v1"
    },
    {
      "role": "current_visibility",
      "rust_path": "radroots_event_store::RadrootsEventStore::current_event_visibility_v1"
    },
    {
      "role": "event_visibility_batch",
      "rust_path": "radroots_event_store::RadrootsEventStore::event_visibilities"
    },
    {
      "role": "projection_lookup",
      "rust_path": "radroots_event_store::RadrootsEventStore::food_availability_v1"
    },
    {
      "role": "projection_recent",
      "rust_path": "radroots_event_store::RadrootsEventStore::recent_food_availability_v1"
    },
    {
      "role": "projection_search",
      "rust_path": "radroots_event_store::RadrootsEventStore::search_food_availability_v1"
    },
    {
      "role": "projection_audit",
      "rust_path": "radroots_event_store::RadrootsEventStore::audit_food_availability_projection_v1"
    },
    {
      "role": "result_vector_executor",
      "rust_path": "food_availability_projection_v1_result_vector"
    }
  ],
  "source_files": [
    {
      "role": "workspace_dependency_authority",
      "path": "Cargo.toml",
      "byte_length": 10836,
      "sha256": "285532dbb0894204843a832880f136ceac5ee312a3203ff951fb0551fac63ec4",
      "hash_algorithm": "sha256_bytes_v1"
    },
    {
      "role": "event_store_dependency_authority",
      "path": "crates/event_store/Cargo.toml",
      "byte_length": 1466,
      "sha256": "9e82d57b64bb7fcf145ee8b919682dd6d788b5503be743d11326f5b882fb2d7e",
      "hash_algorithm": "sha256_bytes_v1"
    },
    {
      "role": "blossom_public_surface",
      "path": "crates/blossom/src/lib.rs",
      "byte_length": 1335,
      "sha256": "61ebee86f02887c45507bab052686da082f74ae26f23d18ff4019e02c70097bd",
      "hash_algorithm": "sha256_bytes_v1"
    },
    {
      "role": "blossom_sha256_value_object",
      "path": "crates/blossom/src/hash.rs",
      "byte_length": 11251,
      "sha256": "753eff6ef9a810045c88839d39a46b37d62a4ad0a5ea57aa30e2a8219e3cdbda",
      "hash_algorithm": "sha256_bytes_v1"
    },
    {
      "role": "food_event_contract",
      "path": "crates/event/src/food_availability.rs",
      "byte_length": 45680,
      "sha256": "1c8c3fba6514f9b246545b3305e8ac2742258857d1b813fa34c5fbefa6135e12",
      "hash_algorithm": "sha256_bytes_v1"
    },
    {
      "role": "food_admission",
      "path": "crates/event_codec/src/food_availability/admission.rs",
      "byte_length": 5799,
      "sha256": "727ebf8f086c14376aba745a0a02b269115fed01e8ce95f90fdd211b9640f842",
      "hash_algorithm": "sha256_bytes_v1"
    },
    {
      "role": "registry_v7_admission",
      "path": "crates/event_codec/src/admission/registry_v7.rs",
      "byte_length": 5350,
      "sha256": "755e63dd7ad1115c219e5a3ea540bef67d2770fc9f2a5aa6ba97c925c99bdced",
      "hash_algorithm": "sha256_bytes_v1"
    },
    {
      "role": "registry_v7_food_projection",
      "path": "crates/event_codec/src/food_availability/inbound/registry_v7.rs",
      "byte_length": 26865,
      "sha256": "908015346eaec97bee6f44fe2a524410b701529ac19a5dab4505706d40d527da",
      "hash_algorithm": "sha256_bytes_v1"
    },
    {
      "role": "event_store_error_surface",
      "path": "crates/event_store/src/error.rs",
      "byte_length": 17557,
      "sha256": "ac206fafdc67e4c25f4a2f1bcd38eb34ae224b38aca55894b1a9cc67242d8b1a",
      "hash_algorithm": "sha256_bytes_v1"
    },
    {
      "role": "generated_descriptor_registration",
      "path": "crates/event_store/src/generated.rs",
      "byte_length": 100,
      "sha256": "ddd71b2245f307cac0c8ef835311d0dd9eb2fdaf9d2a76a6c9dc98e56f4faaec",
      "hash_algorithm": "sha256_bytes_v1"
    },
    {
      "role": "public_surface",
      "path": "crates/event_store/src/lib.rs",
      "byte_length": 3419,
      "sha256": "d5bc071309fd4ec9e26a3cfe9c0e7c00b5de5b6c248902b888891b39e6780d23",
      "hash_algorithm": "sha256_bytes_v1"
    },
    {